0	0
やばいやばいと思いつつ全然進めない自分が嫌になります難しくて何から手を付けていいかわかりませんあと三回なので、最後まで頑張っていきたいと思います。	そんな時は、一回前に戻ってみてください。
 教職のために、計算機数学IIも履修するつもりでいますが、不安です。	大丈夫ですよ、計算機数学Ⅱもできるようになりますよ。
c問題が増えてきて、難しくなってきた。	c問題は難しいので、ゆっくり考えてみてください。
テストが落ち着いたらレポートにも取り組みます深さと幅優先探索がどんなものかはなんとなく理解できましたが、果たしてこのコードを理解し更にかけるようになる日は来るのかと感じました。	使っていけば、理解できるようになる日が来ますよ。
今日のzoomで、周りの生徒の進捗状況が自分よりもだいぶ早そうで、とても焦りました。	大丈夫ですよ、焦らず自分のペースで進めていきましょう。
今日は前回に比べて問題があまり進まなかった。	大丈夫ですよ、ゆっくり取り組んで行きましょう。
問題番号は70番くらいまで進んでるけど解けた数だと58問ということがわかったのでちょっと焦ってきました。	大丈夫ですよ、少しずつ取り組んでみてください。
本日のブレイクアウトルームも他の先生では行わない交流の機会を設けてくださりうれしいのですが、友人が一人もおらず、ちきって入れませんでした。	みんなきっと優しいですよ。応援しています。
問題自体はクイズみたいでアルゴリズムを考えつくことは比較的容易なのですが、コードで表現する部分に苦戦しています。	問題を重ねていけばコードで表現する力もついていきますよ！
慣れるまで少し時間がかかりそうです...	大丈夫ですよ、ゆっくり取り組んで行きましょう。
内容が難しくなって思うように進まなくなった。	そんなときには、一旦前に戻って考えてみてください。
Pythonもなかなか答えにたどり着けなくなってきて悔しいです。	悔しいという思いはいいことですね。ゆっくり解いていきましょう。
AtCoderの課題リストの反映がたまにおかしい時があるので、きちんと先生にも反映されているか心配になることがあります。	そういう時は、先生に声をかけてみてください。
ゴールデンウィークはサボってしまってあんまり全然進みませんでした。	そういう時もありますよ。ゆっくり進めていきましょう。
ラストスパートなのに先週に引き続きやる気が起きなくて危機を感じてます。	とりあえず取り組んでみましょう！
全くついていけないです。	大丈夫ですよ、自分のペースで進めていきましょう。
苦手ということもあり、やろうと思うまでに時間がかかってしまいます。	少しでも取り組んでいくのが良いですよ。
python進めるやる気が出なくなったのですが、そろそろテストも終わり、また期末が来てしまうので今のうちに頑張らなくてはならないなと思います。	やる気がなくなったときには、一旦甘いものなどをとって休んでみては？
前よりも授業内に進むスピードが遅くなっていると感じます。	だんだん解いていくことで速くなっていきますよ！
出遅れている感があり焦っています。	大丈夫ですよ、焦らず自分のペースで進めていきましょう。
内容が難しい。	そんな時は、細かく分けて取り組んでみてください。
だんだんと番号が大きくなるにつれ、内容も重くなってきていると感じます。	だんだんと難しくなっているので、ゆっくり取り組んでいきましょう。
最初のほうはスラスラ解ける問題もありましたが、非常に難しいと感じる問題が増えてきました。	ゆっくり時間をかけて取り組んでみてください。
メンタルがやられそうですが、頑張ります。	自分のペースで頑張っていきましょう！
達成できるか不安です...。	コツコツ進めていけば大丈夫ですよ！
ランタイムエラーが何回か出てしまって困りました。	そういう時は、ゆっくりプログラムを確認しましょう。
今週はいろいろ予定がたまりすぎて進みませんでした。	大丈夫ですよ、自分のペースで進めていきましょう。
defを使うやり方を去年授業で確認してたはずなのですが、あまり理解出来ていなかったらしく、進みが遅くなりそうです。	そういう時は、時間をかけて復習してみてはいかがですか？
ほかの科目の課題が多すぎて泣けます。	コツコツ進めていきましょう！
12回目難しいです。	そうですね、12回目は少し難しいのでゆっくり読んでみてください。
急に難しくなってきて全然理解できなくて落ち込みました。	そういう時は一旦他のことに取り組んでみるのも良いですよ。
 今週はAtCoderをそんな進めることができませんでした。	大丈夫ですよ、自分のペースで進めていきましょう。
自分で考えたプログラミングが間違っていて、他の方の回答をみてみると、そんなに簡単にできるのか!と思うほど短くやっていて、自分は全然分かってないと落ち込みました。	大丈夫ですよ、取り組み続ければだんだん短くできるようになりますよ。
今日の関数はとても難しかったです。	関数は難しいので、また考えてみてください。
今までif、whileを使うときは問題に条件文で書いてある場合や、使って解きなさいと書かれている状況下でしかなかったので、電気プラグの問題でどのように考えれば上手くたどり着くのか自力では思いつきませんでした。	そういう時は細かく分けて考えてみましょう。
目標は100問ですが、これからもっと難しくなるだろうし目標を達成できるか心配です。	大丈夫ですよ、自分のペースで進めていきましょう。
ほかの中間試験が一通り終わったのでこの授業も本腰入れておこうと思います関数が入ってから全然進みますん。	関数は難しいので、ゆっくり考えてみてください。
平均点難しかった。	平均点は難しいですね。また復習してみてください。
別の話になってしまうのですが、後期の計算機数学は対面でやりますか?あと残り3回と知って焦っています。	焦らず、ゆっくり取り組んでみてください。
星集めはちょっと難しいですAtCoderは50(おつり)まで進みました。	星集めは難しいので、また復習してみてください。
1年のプログラミングの授業をオンラインだったのもあり、途中からわからなくなったのを放置していたので全くわからない状態です。	そんな時は、一旦前に戻って復習していきましょう。
わからないところを飛ばしてどんどん進んでしまっているので、進捗はあまりよくないと思います。	そんな時は、ぜひどこかで昔の問題に戻ってみてくださいね。
まだなんとかなると信じてます...ちょっとした打ち間違えや問題の読み取りミスが多くて参りました。	落ち着いて問題に取り組んでみましょう。
関数を使い慣れていないので難しかったです。	関数は難しいので、また取り組んでみてください。
チャレンジ問題授業内で少しやろうかと思ったのですが、難しくて、一度断念。	一旦他のことをやることもいいですよね。
去年は一人でプログラミングの授業を受けていたので不安だらけでした。	わからない部分は、声をかけてくださいね。
 アンケートに目標が150問と書きましたが、現在60問ほどしか進んでおらず、来週からアルゴリズムになるのにまずいな、、、と思いました。	焦らず、自分のペースで進めていきましょう。
また改めて、while、for構文に苦手意識があるなあと思いました。	苦手な部分は、ゆっくり復習をしながら進めていきましょう。
今日はPCの調子がおかしく、Colaboratoryが動かなかったりカーソルが動かせなかったりで全然進みませんでした。	そういう時は、無理せずできることをやってみてください。
大きい躓きというよりは小さいものなので先生にも対面ならいいですがオンラインだと聞きづらいです。	大丈夫ですよ、気にせず声をかけてみてください！
進んでいなくてかなりまずいです。	落ち着いて少しずつ取り組んでみてください。
分からなくて、他の人のコード参考にしようと思っても全然理解できなくてやばいって思ってます。	そういう時は、いろいろなコードを参考にしてみてください。
頑張ればA、A+は必ず取れるので明確な基準設けてくれるのありがたいと思いましたA+取れるように頑張ります12回以降は難しすぎて、やる気が出ません	一旦、他のことに取り組んでみるのも良いですよ。
13日のABC、C問題まで解けた、が、振り返ってみるとびっくりするほどややこしいやり方で解いていて、後悔した。	まずは解けたことが大切です。
演習問題は差分の和で詰まってしまい、悲しかったです。	時には休むことも大切ですよ。
第8章から解説を見ながらでないと解けなくなってきていて焦ります。	焦らず、じっくり考えてみてください。
アルゴリズムが本当に難しいです。	アルゴリズムは難しいので、時間をあけて再度取り組んでみてください。
私には難しい。	そんな時は、細かく分けて取り組んでみてください。
特に、for文や演算系(+=など)を使うべき問題が難しかったです。	for文は難しいので、ゆっくり考えながら進めてみてください。
20日は休講で特にやっていないため何も進んでいません。	大丈夫ですよ、自分のペースで進めていきましょう。
最近自分一人で解ける問題が全然なくて焦っています。	大丈夫ですよ、取り組んでいけばだんだんできるようになりますよ。
